full_text,label
ok and which do you depend on,Asking_for_information
group - does anyones part depend on the connecting rod ?   t 1  or r 1    thickness or length ,Asking_for_information
i did try it a few minutes ago  did anythjing change ?  Ill try it again,Asking_for_information
group - does anyones part depend on the connecting rod ?   t 1  or r 1    thickness or length ,Asking_for_information
group - does anyones part depend on the connecting rod ?   t 1  or r 1    thickness or length ,Asking_for_information
group - does anyones part depend on the connecting rod ?   t 1  or r 1    thickness or length ,Asking_for_information
and which do you need,Asking_for_information
also how much does bore diameter effect you ?  If i go down to the lowest bore diameter I can increase factorofsafety a bit,Asking_for_information
Could you reselect your previous lower mass simulation if you havent already ? ,Asking_for_information
what r do you have for the pin ? ,Asking_for_information
what is your range for mass ? ,Asking_for_information
Whats your factorofsafety,Asking_for_information
do you depend on my variables ? ,Asking_for_information
because i believe your part is the heaviest,Asking_for_information
Lets improve lowest factorofsafety now  What is yours ? ,Asking_for_information
Lets improve lowest factorofsafety now  What is yours ? ,Asking_for_information
Lets improve lowest factorofsafety now  What is yours ? ,Asking_for_information
Lets improve lowest factorofsafety now  What is yours ? ,Asking_for_information
group- does anyone depend on flywheelthickness  flywheeldiameter,Asking_for_information
group- does anyone depend on flywheelthickness  flywheeldiameter,Asking_for_information
group- does anyone depend on flywheelthickness  flywheeldiameter,Asking_for_information
group- does anyone depend on flywheelthickness  flywheeldiameter,Asking_for_information
Could you try decreasing it again ?  I mass trying to raise my factorofsafety more since my mass is so small,Asking_for_information
is there any way you can increase factorofsafety,Asking_for_information
What is your range of factorofsafety ? ,Asking_for_information
what do you need,Asking_for_information
What s the factorofsafety of your current selection ?  I mass trying to figure out what part has the most influnce over factorofsafety,Asking_for_information
What s the factorofsafety of your current selection ?  I mass trying to figure out what part has the most influnce over factorofsafety,Asking_for_information
What s the factorofsafety of your current selection ?  I mass trying to figure out what part has the most influnce over factorofsafety,Asking_for_information
do you depend on t 1  or r 1  ? ,Asking_for_information
Have you been changing the piston and seeing how the piston-pin can be changed ? ,Asking_for_information
can you change yours ?  Piston and flywheel just changed theres,Asking_for_information
 Do you guys just want to keep this setting and change one at a time ? ,Asking_for_information
do you depend on t 1  or r 1  ? ,Asking_for_information
Something just took a hit  Any idea what changed ? ,Asking_for_information
what option are you currently on,Asking_for_information
how much does your factorofsafety increase though ?  because then we could save mass in other parts,Asking_for_information
group :  who s next ? ,Asking_for_information
What is your factorofsafety ? ,Asking_for_information
group :  who s next ? ,Asking_for_information
group :  who s next ? ,Asking_for_information
you done ? ,Asking_for_information
group :  who s next ? ,Asking_for_information
do you depend on t 1  or r 1  ? ,Asking_for_information
do you depend on t 1  or r 1  ? ,Asking_for_information
whats your current factorofsafety,Asking_for_information
can you raise factorofsafety still ? ,Asking_for_information
Is your factorofsafety twelve hundred ?  ?  ,Asking_for_information
 anyone has lower factorofsafety change when mass dec ? ,Asking_for_information
do you think lower diameter will give you a higher factorofsafety ? ,Asking_for_information
t 1  or flywheelthickness ? ,Asking_for_information
what do you control ,Asking_for_information
what what happened ?  We had our factorofsafety above  2  ,Asking_for_information
what what happened ?  We had our factorofsafety above  2  ,Asking_for_information
Can you reduce piston factorofsafety ? ,Asking_for_information
We had fair a minute ago  who has been making changes ?  I haven t changed anything,Asking_for_information
We had fair a minute ago  who has been making changes ?  I haven t changed anything,Asking_for_information
We had fair a minute ago  who has been making changes ?  I haven t changed anything,Asking_for_information
We had fair a minute ago  who has been making changes ?  I haven t changed anything,Asking_for_information
Whoever just changed something about factorofsafety change it back   It made it worse,Asking_for_information
Whoever just changed something about factorofsafety change it back   It made it worse,Asking_for_information
Whoever just changed something about factorofsafety change it back   It made it worse,Asking_for_information
Group :  alert everyone before you change anything ,Asking_for_information
Group :  alert everyone before you change anything ,Asking_for_information
Group :  alert everyone before you change anything ,Asking_for_information
Group :  alert everyone before you change anything ,Asking_for_information
okay i ust put my factorofsafety to  63   did it affect it much ? ,Asking_for_information
flywheel  are you good ? ,Asking_for_information
okay i just put my factorofsafety to  63   did it affect it much ? ,Asking_for_information
Are you done flywheel ? ,Asking_for_information
should i switch back then ? ,Asking_for_information
Lets try and get back to where Fair was  that seemed like the right track,Asking_for_information
group :  who wants to go next ? ,Asking_for_information
you next ? ,Asking_for_information
group :  who wants to go next ? ,Asking_for_information
whats your factorofsafety now ? ,Asking_for_information
group :  who wants to go next ? ,Asking_for_information
group :  who wants to go next ? ,Asking_for_information
Can you improve factorofsafety ? ,Asking_for_information
Lets see what happens ? ,Asking_for_information
so keep playing with your parameters and ill let you know how it impacts me,Asking_for_information
what is your current mass and factorofsafety ? ,Asking_for_information
what is your current mass and factorofsafety ? ,Asking_for_information
what is your current and factorofsafety ,Asking_for_information
what is your current mass and factorofsafety ,Asking_for_information
Can you try decreasing diameter back to  45  ? ,Asking_for_information
Are we good to end ? ,Asking_for_information
should we end ? ,Asking_for_information
We at fair  Good enough ? ,Asking_for_information
We at fair  Good enough ? ,Asking_for_information
We at fair  Good enough ? ,Asking_for_information
We at fair  Good enough ? ,Asking_for_information
What kind of bore diameter are you thinking ? ,Asking_for_information
how are you,Asking_for_information
Hey ,Asking_for_information
Hey,Asking_for_information
What s the best crankshaft offset ? ,Asking_for_information
what is the offset you have decided to use for the crannkshaft bearing offset ? ,Asking_for_information
Is it better for the piston bore diameter to be larger or smaller ? ,Asking_for_information
Do you have any idea about the pistonborediameter value ? ,Asking_for_information
Do you have a good flywheel diameter and flywheel thickness ? ,Asking_for_information
Is it better for the thickness of the flywheel to be larger or smaller ?  What about the flywheel shaft diameter ? ,Asking_for_information
Hey,Asking_for_information
Do you have a value for the crankshaft bearing offset  bearingoffset ,Asking_for_information
What s a good working piston bore diameter ? ,Asking_for_information
what s your current piston bore diameter ? ,Asking_for_information
What value would be ideal for the flywheel ? ,Asking_for_information
what bore diameter are you using ? ,Asking_for_information
Hi  looks like we should increase the factor of safety  What factor of safety do you have for the piston,Asking_for_information
What do you currently have for your bore diameter ? ,Asking_for_information
Is there a way to see the other values ?  The main one updates but I can t see others ,Asking_for_information
is your current value exactly  90  ? ,Asking_for_information
what is your piston bore diameter ?   40  ? ,Asking_for_information
Do you have piston bore diameter ?  pistonborediameter ,Asking_for_information
What is the factor of safety of the connecting rod at the moment ? ,Asking_for_information
what bore diameter are you using ? ,Asking_for_information
Does the flywheel thickness or flywheel shaft diameter affect any of your components ? ,Asking_for_information
how you doing,Asking_for_information
Does the flywheel thickness or flywheel shaft diameter affect any of your components ? ,Asking_for_information
what is your current value for flywheel shaft diameter ? ,Asking_for_information
Does the flywheel thickness or flywheel shaft diameter affect any of your components ? ,Asking_for_information
Does the flywheel thickness or flywheel shaft diameter affect any of your components ? ,Asking_for_information
Have you changed bore diameter at all ? ,Asking_for_information
What s your current factorofsafety ? ,Asking_for_information
what can we do in terms of slimming down mass,Asking_for_information
so lower piston diamter lowers your factorofsafety ? ,Asking_for_information
What s your current factorofsafety ? ,Asking_for_information
see what the other group members say,Asking_for_information
Would increasing or decreasing flywheeldiameter lower the weight ? ,Asking_for_information
Is there a way to lower that ?  Mass is way too high and factorofsafety too low,Asking_for_information
What s is the factor of safety for the piston-pin ? ,Asking_for_information
Can we lower that ?  It might drop mass ,Asking_for_information
Thanks  What s your factorofsafety ? ,Asking_for_information
what are you factorofsafety Ms at rn ? ,Asking_for_information
what are you factorofsafety Ms at rn ? ,Asking_for_information
what are you factorofsafety Ms at rn ? ,Asking_for_information
how much does does the thickness of rod effect the factor of safety,Asking_for_information
what are you factorofsafety Ms at rn ? ,Asking_for_information
what s your design variables ? ,Asking_for_information
also  can you give me flywheelthickness  flywheel thickness  ? ,Asking_for_information
factorofsafety ? ,Asking_for_information
Does  2   09  affect mass significantly ? ,Asking_for_information
How does the bearing support offset affect your part ? ,Asking_for_information
what are your design variables ? ,Asking_for_information
Does the crank-pin diameter affect your part ? ,Asking_for_information
What are your design variables ? ,Asking_for_information
does a larger diameter increase your mass ?  or decrease it ? ,Asking_for_information
What are your design variables ? ,Asking_for_information
Can you lower your diameter a touch ?  My options depend only on that ,Asking_for_information
should we try  85  for dia ? ,Asking_for_information
did you change the bore diameter ? ,Asking_for_information
does it auto update or do we have to refresh or something,Asking_for_information
what is your factorofsafety ? ,Asking_for_information
what is your factorofsafety ? ,Asking_for_information
what is your factorofsafety ? ,Asking_for_information
what is your factorofsafety ? ,Asking_for_information
 ? ,Asking_for_information
What external variables affect your design ? ,Asking_for_information
you too ,Asking_for_information
let me reduce the pistonborediameter to  40 ,Asking_for_information
Isnt our factorofsafety about which part has the lowest ? ,Asking_for_information
is it possible to increase your factor of safety ? ,Asking_for_information
bets on who goes rogue,Asking_for_information
what is your factorofsafety for the  1   13  ? ,Asking_for_information
Do you know whose factorofsafety is the lowest at the moment ? ,Asking_for_information
lets take bets on who goes rogue,Asking_for_information
What are your values,Asking_for_information
What is your factorofsafety right now ? ,Asking_for_information
Yes please ,Asking_for_information
what is your factorofsafety right now ? ,Asking_for_information
what is your factorofsafety right now ? ,Asking_for_information
hbu ? ,Asking_for_information
but then,Asking_for_information
for factorofsafety,Asking_for_information
how do i know it wasnt you ?  ? ,Asking_for_information
whut is your name,Asking_for_information
whats it to u,Asking_for_information
agreed but isnt the factor of safety shown above that of the part with the lowest factorofsafety ? ,Asking_for_information
i kinda wanna know who the other people are,Asking_for_information
should i ask their names,Asking_for_information
do ti,Asking_for_information
okay you ask piston guy,Asking_for_information
Will making the bore diameter smaller improve your factorofsafety ? ,Asking_for_information
where u at,Asking_for_information
whats your name fam ? ,Asking_for_information
What is your factorofsafety ? ,Asking_for_information
what are your current values for mass and factorofsafety ? ,Asking_for_information
what is your factorofsafety ? ,Asking_for_information
could you make it larger ? ,Asking_for_information
 ? ,Asking_for_information
ok so do you know why our mass is so high,Asking_for_information
tell him to sneeze,Asking_for_information
okay  what s your weight ? ,Asking_for_information
lmao both of them ? ,Asking_for_information
the dream team,Asking_for_information
For just the flywheel ? ,Asking_for_information
so yes smaller piston diameter improves my factorofsafety,Asking_for_information
does yours say that too ? ,Asking_for_information
tell him to reply or ur changing ur value,Asking_for_information
wait which two is it ?  the two directly behind us ?  or the one sitting like further right ? ,Asking_for_information
whats your mass ? ,Asking_for_information
what is your mass currently ? ,Asking_for_information
so probably not ideal right ? ,Asking_for_information
do it,Asking_for_information
i wonder if they read these as part of the study ,Asking_for_information
are the other people responding,Asking_for_information
Do you know why the mass is so high ? ,Asking_for_information
what is the range of masses you can select ? ,Asking_for_information
Anything ? ,Asking_for_information
what s your factorofsafety,Asking_for_information
what s your factorofsafety,Asking_for_information
what s your factorofsafety,Asking_for_information
if we all go for similar factorofsafety at around  3  we should be able to get global factorofsafety as  3  right ? ,Asking_for_information
what is the range for your mass values ? ,Asking_for_information
What s your factorofsafety given the crankshaft bearing offset that the crankshaft has ? ,Asking_for_information
whats your factorofsafety at for current settings,Asking_for_information
what numbers are u running,Asking_for_information
did u ever get ur  375  exam back,Asking_for_information
whats your factorofsafety at,Asking_for_information
Okay  do you know who is making the factorofsafety so low ? ,Asking_for_information
and mass ? ,Asking_for_information
Is there any way you can lower your weight ? ,Asking_for_information
What is your factorofsafety ? ,Asking_for_information
what is your factorofsafety ? ,Asking_for_information
Our factorofsafety just got very low  Any idea which part it is ? ,Asking_for_information
but it s better,Asking_for_information
what is your factorofsafety ? ,Asking_for_information
what mare mass values around an factorofsafety of  2 ,Asking_for_information
Can you make your weight any lower with an factorofsafety above  2  ? ,Asking_for_information
mass and factorofsafety for you ? ,Asking_for_information
Can you make your weight any lower with an factorofsafety  greater than   2  ? ,Asking_for_information
does urs go straight,Asking_for_information
really ? ,Asking_for_information
know whats our next challenge,Asking_for_information
what are your ranges ? ,Asking_for_information
that doesn t make sense  you said your mass was  3   46  ? ,Asking_for_information
did u get the light sensor working,Asking_for_information
what is your factorofsafety rn ? ,Asking_for_information
 sidenote :  this experiment is probably just recording what we do after we solve the problem,Asking_for_information
like our robot is handicapped,Asking_for_information
what is the category ? ,Asking_for_information
Do you know whats up,Asking_for_information
our value was really good did you make a change a second ago ? ,Asking_for_information
object ?  i dont know the options for categories lol,Asking_for_information
did you make a change ? ,Asking_for_information
piston-pin ? ,Asking_for_information
what offset are you using,Asking_for_information
q 1  :  is it smaller than a microwave ? ,Asking_for_information
what are your values,Asking_for_information
are you chaning values and updating your broadcast ? ,Asking_for_information
think low factorofsafety is from piston pin,Asking_for_information
q 4  :  did we talk about it in our classes this semester ? ,Asking_for_information
what is your factorofsafety,Asking_for_information
what is your factorofsafety ? ,Asking_for_information
ready ? ,Asking_for_information
What value do you intend to use for your crank-shaft offset ? ,Asking_for_information
Also  what is optimal in terms of parameters for you ? ,Asking_for_information
What is the piston bore diameter ? ,Asking_for_information
What Bore diameter are you thinking about using ? ,Asking_for_information
I need to know the piston bore diameter from you,Asking_for_information
Are there any parameters from the flywheel that affect your factor of safety or mass of your sub system ? ,Asking_for_information
Are there any parameters from the flywheel that affect your factor of safety or mass of your sub system ? ,Asking_for_information
Are there any parameters from the flywheel that affect your factor of safety or mass of your sub system ? ,Asking_for_information
does that work well for you ? ,Asking_for_information
What is the current value of the bore ? ,Asking_for_information
Do you have any that depend on the piston pin ? ,Asking_for_information
Are you in charge of choosing the piston bore diameter ? ,Asking_for_information
does that work well for your subsystem ? ,Asking_for_information
Does a larger thickness negatively affect factorofsafety or mass ? ,Asking_for_information
Let me know what piston bore diameters are working for you  I will need to update my dimensions ,Asking_for_information
Hey  is there any chance you could choose the setting that has the highest factorofsafety and broadcast it ? ,Asking_for_information
Hey  is there any chance you could choose the setting that has the highest factorofsafety and broadcast it ? ,Asking_for_information
Hey  is there any chance you could choose the setting that has the highest factorofsafety and broadcast it ? ,Asking_for_information
Hi  I mass working on the piston-pin design what parameters are you changing for your design ? ,Asking_for_information
Let me know what flywheel thicknesses and flywheel shaft diamters are working for you  I will need to update my dimensions ,Asking_for_information
What are you choosing for your initial piston bore diameter ? ,Asking_for_information
Hey  I mass changing the piston diameter and the piston head thickness  What parameters are you changing ? ,Asking_for_information
what crankshaft offset is ideal for your design ?  I need it to design the flywheel,Asking_for_information
what are you currently using for pistonborediameter ? ,Asking_for_information
I did it do you see it ? ,Asking_for_information
do you have a diameter that you feel comfortable working with ? ,Asking_for_information
I need to know your crankshaft bearing offset value so tell me if you find anything good,Asking_for_information
any suggestions ? ,Asking_for_information
on my screen it says your limit is between  150  and  300  ? ,Asking_for_information
Thank you  Will you please update me if it changes by more than  5  ? ,Asking_for_information
Are you still going with a crankshaft of  80  ? ,Asking_for_information
What parameters can you change,Asking_for_information
do you have any parameters that depend on the piston pin ? ,Asking_for_information
totally unsure what  4  simulations you mean,Asking_for_information
sweet thanks - let me know when you do,Asking_for_information
Do you have any parameters that depend on the piston pin ? ,Asking_for_information
What is the offset that is working well for you ? ,Asking_for_information
yes  do you need that changed ? ,Asking_for_information
Optimize factorofsafety first then mass ? ,Asking_for_information
Do you have any parameters that depend on the connecting rod ? ,Asking_for_information
do you need to know flywheel parameters for your design ? ,Asking_for_information
Should have gone through ?  bearingoffset equals to   150   dc equals to  50 ,Asking_for_information
What s your flywheel shaft diameter and thickness of flywheel ? ,Asking_for_information
Piston bore diameter ? ,Asking_for_information
Do you need info from me,Asking_for_information
Do you need info from me,Asking_for_information
Do you need info from me,Asking_for_information
Has yours updated yet ? ,Asking_for_information
I do not think so  you need anything from me ? ,Asking_for_information
let me know what you think crank bearing offset  bearingoffset  will be,Asking_for_information
Do you need anything from me ? ,Asking_for_information
nope  do you need info from me ? ,Asking_for_information
are you the conrod designer,Asking_for_information
Need anything from me ? ,Asking_for_information
What are your current parameters ? ,Asking_for_information
Need anything from me ? ,Asking_for_information
Need anything from me ? ,Asking_for_information
do you need anything from me ? ,Asking_for_information
what values are you using for the input poston bore diameter ? ,Asking_for_information
what is you flywheel thickness ? ,Asking_for_information
Are you still running with diameter of  40 ,Asking_for_information
 ? ,Asking_for_information
my mass is less than  2   who has the biggest contribution ? ,Asking_for_information
let me know what you think crank bearing offset  bearingoffset  will be,Asking_for_information
my mass  equals to   6   im guessing connecting rod ? ,Asking_for_information
Thank you,Asking_for_information
Hi  I mass working on the piston-pin design what parameters are you changing for your design ? ,Asking_for_information
Hi  I mass working on the piston-pin design what parameters are you changing for your design ? ,Asking_for_information
Hi  I mass working on the piston-pin design what parameters are you changing for your design ? ,Asking_for_information
what is the mass of your design ? ,Asking_for_information
What is the mass of your components ? ,Asking_for_information
has the bore diameter updated ? ,Asking_for_information
whats your mass ? ,Asking_for_information
Do you know how bearingoffset affects your factorofsafety,Asking_for_information
whats your mass ? ,Asking_for_information
 ? ,Asking_for_information
what is the mass of your system ? ,Asking_for_information
How are we looking with factorofsafety ?  Im at  4   09 ,Asking_for_information
How are we looking with factorofsafety ? ,Asking_for_information
what is the mass of your system ? ,Asking_for_information
whats your mass at the moment,Asking_for_information
Can you increase your diameter ? ,Asking_for_information
What is your mass ? ,Asking_for_information
How is your design coming along  do you need any data from me ? ,Asking_for_information
What is your mass ? ,Asking_for_information
I have bearingoffset and dc what do you control ? ,Asking_for_information
Do you need any dimensions from me ? ,Asking_for_information
Do you need any dimensions from me ? ,Asking_for_information
what is your bore diameter ? ,Asking_for_information
Yeah  what s your system mass atm ? ,Asking_for_information
What are you using as your diameter,Asking_for_information
Do you need to increase it ? ,Asking_for_information
What s the mass that you are using ? ,Asking_for_information
got it,Asking_for_information
Hi what is the mass that you are currently using ? ,Asking_for_information
Whats your factorofsafety ? ,Asking_for_information
And also the factorofsafety ? ,Asking_for_information
how about factorofsafety ? ,Asking_for_information
What s your max mass ? ,Asking_for_information
what s your max mass ? ,Asking_for_information
What is your piston bore diameter ? ,Asking_for_information
What is your factorofsafety ? ,Asking_for_information
What is your factorofsafety ? ,Asking_for_information
have you considered using  75  ? ,Asking_for_information
What is the lower range of your weight range,Asking_for_information
what bearingoffset value do you currently have ? ,Asking_for_information
What is the lower limit of your weight range ? ,Asking_for_information
Piston diameter still  90  ? ,Asking_for_information
can you broadcaset  150  ? ,Asking_for_information
what is bearingoffset ? ,Asking_for_information
My dimension ? ,Asking_for_information
What is your range for diameter ? ,Asking_for_information
is your maz  105  mm ? ,Asking_for_information
What is your range for diameter ? ,Asking_for_information
What is your range for diameter ? ,Asking_for_information
What s your system mass and factorofsafety ? ,Asking_for_information
What s your system mass and factorofsafety ? ,Asking_for_information
What s your system factorofsafety ? ,Asking_for_information
what is your flywheel shaft diameter ? ,Asking_for_information
are you changing your numbers a lot ? ,Asking_for_information
