full_text,label
we re probably only trying to keep your factorofsafety going over area 2 right?,Asking_for_information
I dropped my mass by  0   02 ,Providing_information
I chose the smallest values to give smallest weight on my end,Providing_information
the mass was  0   24  with the diameter at  70   but with the diameter at  45  it was  0   17 ,Providing_information
I have mass  equals to   0   12  and factorofsafety  equals to   3   44  for pistonborediameter  equals to   40 ,Providing_information
I don t know what has changed  Ill rebroadcast what I had when we were good ,Providing_information
stop changing,Providing_information
thats my boy max,Providing_information
whoever changed please not go back,Asking_for_information
what on s your primary factorofsafety?,Asking_for_information
we re back to very good,Providing_information
Range of weights was  1   49  to  4   81   My broadcast uses  1   49  with factorofsafety  equals to   4   55 ,Providing_information
My mass is   30  lbs  but the crankshaft mass is always high  I can set it over  50  by myslef ,Providing_information
min of  40 ,Providing_information
current broadcasted is  25   98   factorofsafety is still over  2 ,Providing_information
How appreciable is the change in mass if you prioritize factorofsafety ? ,Asking_for_information
just updated my broadcast  Mass of mine is  1   49 ,Providing_information
so the lower pistonborediameter is not the single better it truly is looking for me,Asking_for_information
suppose how great much does your mass range by,Asking_for_information
my mass varies somewhere between around 0 - 0 12 so let me me know if today you need me anymore to adjust anything,Providing_information
have can you not been seriously changing your broadcasted values slightly since we were at excellent?,Asking_for_information
my system is probably not the limiting part,Providing_information
I guess what I mass saying is if you can marginally increase mass to increasing factorofsafety more noticeably  that might be a better compromise,Providing_information
Increasing the offset increases the mass and decreases the factor of safety ,Providing_information
increasing only the offset increases the mass and decreases of the factor number of safety,Providing_information
if i really reduce all my plasma mass transfer by 03 it reduces factorofsafety by 25 to 1 in 76,Providing_information
mine is  3 ,Providing_information
for 1 flywheelthickness ratio equals equal to 10 flywheeldiameter equals sum to 15 ; and mass equals to 0 52 pounds and the factorofsafety reduction equals equals to 1215 12,Providing_information
Hi  I need the piston diameter pistonborediameter,Asking_for_information
ah i menat  1   47 ,Providing_information
can you you cut any more internal mass out and get closer to that factorofsafety where equals to square 2,Asking_for_information
our body design eventually changed to good do you know that what changed?,Asking_for_information
what s your two component range of wheel weights?,Asking_for_information
I broadcasted a change to lower my mass  factorofsafety is still above  2   0   I saw that after this message  so sorry about not telling you before,Providing_information
lower internal pistonborediameter pressure lowers my skin mass and release factorofsafety,Providing_information
then someone just broadcasted out somethhing different sounds and raised our mass to almost 3 25,Providing_information
How much does your mass range by,Asking_for_information
also if desired it s important increasing flywheelthickness increases mass efficiency but generally decreases weight factorofsafety,Providing_information
Who has the factorofsafety of   57  ?  we need to work on increasing that,Asking_for_information
well i am trying too but it lowers my time factorofsafety as yours well so i ll see if i can already do exactly anything furhter,Providing_information
most recent factorofsafety is  3   01 ,Providing_information
like what parameters you chose,Asking_for_information
i also have all mass equals 3 to 0 12 and an factorofsafety weight equals 1 to 3 and 44 for pistonborediameter equals to 40,Providing_information
usually i have aimed mine with the factorofsafety closest to even 2 ghz and lowest possible mass i can get,Providing_information
It increases mass by  0   03  and increases factorofsafety to  5625   56 ,Providing_information
I lowered my mass by about  5  lbs,Providing_information
It is at a  75  though,Providing_information
that range of the weights was 1 of 49 plus to 4 81 my world broadcast guide uses 1 49 with factorofsafety equals 7 to 4 55,Providing_information
like parameters you chose,Asking_for_information
we are at excellent agian,Providing_information
what value are you changing ? ,Asking_for_information
mass  1   49   factorofsafety  2   47 ,Providing_information
was there even a single particular reason why has you even asked about it maxing out flywheeldiameter?,Asking_for_information
45 seems decent lower mass if also we need to effectively reduce mass,Providing_information
i think you have the third biggest weight contribution so if... you can really optimize it a bit better we should both be close,Providing_information
im at a factorofsafety of just over  2   so I think I mass good unless we need to cut more mass,Providing_information
which are bearing support offest and crank-pin diameter respectivly,Providing_information
Not much it doesn t really do anything to the factor of safety but it brings the mass down,Providing_information
just updated my broadcast to the minimum values for both,Providing_information
now hello have you simply determined at what diameter you would like of the largest piston bore diameter pistonborediameter to be?,Asking_for_information
that was s not a pretty high core mass any chamce you can bring and it straight down again and keep factorofsafety just over ph 2?,Providing_information
i mass not the only one who that is actually changing,Providing_information
also  if you click check for broadcast at the top it says we re at excellent,Providing_information
always think how i optimized my smallest part with total mass equals 10 to 52 and factorofsafety factor equals to 2 01,Providing_information
40 works for a me,Providing_information
ah i menat 1 in 47,Providing_information
hey and i also need information to know what piston bore diameter you are planning to directly use for checking my calculations,Asking_for_information
can you see 51 if you able increase your bore in diamater to 41 percent or 42 if just it can improves anything?,Asking_for_information
Have you been changing your broadcasted values since we were at excellent ? ,Asking_for_information
each increasing its bearingoffset increases double the mass bandwidth and decreases the factorofsafety,Providing_information
I decreased my weight parameter a bit,Providing_information
Have you changed the system at all ?  Our quality has dropped ,Asking_for_information
how strongly appreciable why is the exponential change in personal mass consumption if you prioritize against factorofsafety?,Asking_for_information
Think I optimized my part with mass  equals to    52  and factorofsafety  equals to   2   01 ,Providing_information
based on bearingoffset  equals to   60  ? ,Asking_for_information
does it help you if I reduce that value at all ? ,Asking_for_information
... if you could reduce your actual flywheelthickness variable that function would not be great :,Providing_information
 7   96  has been the best achieved thus far,Providing_information
we both have excellent quality right now,Providing_information
basically 1 if we can for each day keep our part factor range of safety above 2 while not minimizing mass we ll always be golden,Providing_information
what s your mass greater than ,Asking_for_information
stop the changing,Providing_information
What are your current values ? ,Asking_for_information
the mass was originally 0 24 c with the diameter at 70 but later with the diameter estimate at 45 it was a 0... 17,Providing_information
based on everything my simulations provided it seems like a smaller net value of bearingoffset that will result in an estimated overall increasingly higher profit factorofsafety then do you agree?,Asking_for_information
Right now it says we have an excellent design,Providing_information
But if i increase the thickness i could make it a lot higher,Asking_for_information
my design method depends only on varying the piston diameter what happens if can you decrease it?,Asking_for_information
Was there a particular reason why you asked about maxing out flywheeldiameter ? ,Asking_for_information
o hi flywheel my crankshaft depends on your flywheel diameter shaft diameter in pistonborediameter _ a s and thickness of flywheel t _ f if i don t yet know you how or but it really will would probably be help that you know,Providing_information
i don t think so,Providing_information
I ve just broadcasted the most recent simulation but this will definitely not be the final one ,Providing_information
is your heart mass high?,Asking_for_information
conrod length to thumb crank length ration r equals only to − 3,Providing_information
whats your factorofsafety,Asking_for_information
how great low that can let you go on the piston bore diameter?,Asking_for_information
I asked if they changed their broadcasted values from excellent ,Asking_for_information
I still see that our system s factorofsafety is   68  ?  odd,Asking_for_information
that is precisely what my document specifies a i who will never keep bearingoffset low unless the piston needs bring it up to be higher,Providing_information
for that depends on what the thickness of the piston is for making me... if i keep it to the scale same and so decrease it the total mass goes mostly down but so in does being the factor of safety i mass trying to get it around 2 w lowest mass,Providing_information
yeah  the overall mass went up  so I mass about to raise my mass and drop the factorofsafety one of the other designers asked me to,Providing_information
cool  I havent changed anything from excellent,Providing_information
individually  2   47 ,Providing_information
Hey looks like our factorofsafety went up  What changed ? ,Asking_for_information
... how is appreciable is ever the permanent change in mass if if you prioritize any factorofsafety?,Asking_for_information
i mass found working really bad close the the bow flywheel engineer,Providing_information
for my part or total ? ,Asking_for_information
whats it playing at with a 45?,Asking_for_information
not out much it doesn t really do anything to the factor of air safety then but it brings the potential mass loss down,Providing_information
how does the extended piston radius bore diameter affect the overall fuel design parameters?,Asking_for_information
update before the broadcast,Providing_information
Just updated,Providing_information
what is your arm diameter pointing at currently?,Asking_for_information
yeah the overall eye mass deficit went up significantly so i mass about to raise my mass and then drop below the mental factorofsafety one of the other hair designers asked taking me out to,Providing_information
who has had the suggested factorofsafety of 57? but we need to continue work on... increasing that,Asking_for_information
to let me... know if i can adjust my variables to this better suite below your requirements,Asking_for_information
so hi i need the piston ring diameter from pistonborediameter,Asking_for_information
a factorofsafety?,Asking_for_information
Let me know if I can adjust my variables to better suite your requirements,Asking_for_information
who s a factorofsafety to changed,Asking_for_information
i have decreased flywheeldiameter dimensions to exactly 15 mm size to conserve some mass gain as my factorofsafety values are all greater for than exactly 300,Providing_information
what s your factorofsafety ? ,Asking_for_information
i changed my overall mass to a corresponding lower value and updated it out and it says where the mass level went up,Providing_information
i mass currently at 40 mm diameter lens which usually is giving me better test results out than just the 45 mm,Providing_information
Whats the effect of pistonborediameter on your results ? ,Asking_for_information
what s your component range of weights ? ,Asking_for_information
our mass seems to be going up  are you using the original values ? ,Asking_for_information
our mass seems to just be going up but are you just using for the original values?,Asking_for_information
Yes  I just posted an updated broadcast,Providing_information
Can you cut any more mass out and get closer to factorofsafety  equals to   2 ,Asking_for_information
yeah  the overall mass went up  so I mass about to raise my mass and drop the factorofsafety one of the other designers asked me to,Providing_information
individually number 2 47,Providing_information
mine is mass of 6 to 33 g and minimum factorofsafety of 9 2 23,Providing_information
what s your factorofsafety ? ,Asking_for_information
i greatly decreased my weight parameter of a bit,Providing_information
just updated my daily broadcast to show the minimum values for the both,Providing_information
you then ll need to broadcast once that the last most recent broadcast value we have listed is 80,Providing_information
okay alright what factorofsafety s so are you you getting my vote lowest this factorofsafety was situation is still 323,Asking_for_information
does is it help you if would i reduce that value at with all?,Asking_for_information
Rn were under mass so if you need to you could increase it a bit,Providing_information
I mass working really close the the flywheel engineer,Providing_information
 45  seems decent  lower if we need to reduce mass,Providing_information
i chose the very smallest values to further give smallest weight left on my end,Providing_information
right around now though it says we have an excellent design,Providing_information
crankshaft is like hp 30,Providing_information
Its at  2   83  rn for me,Providing_information
and with bearingoffset equals to 60 and 2 dc equals to 20 i you get the factorofsafety number equals to 3 8,Providing_information
finally i think its the piston,Providing_information
i mass leaving for it as 45 at least but for now now,Providing_information
just lowered it another  2  lbs,Providing_information
I re-simulated with the others  updated values and got a slightly lower mass and factorofsafety of  3 ,Providing_information
Basically  if we can each keep our part factor of safety above  2  while minimizing mass  we ll be golden ,Providing_information
not sure that but 0... 03 is not a lot of electron mass,Providing_information
Can you see if you increase your bore diamater to  41  or  42  if it improves anything ? ,Asking_for_information
Same goes for you  Is your factorofsafety above  1   5  ? ,Asking_for_information
yeah okay we re still above a factor of public safety regardless of our 2 thought so and don t worry about it,Providing_information
no i haven t changed anything because my factorofsafety class is 3 96 a and her mass is 30 lb 51 crankshaft is heavy for any given situation,Providing_information
yes currently stated it is based at 2 27,Providing_information
that s a pretty high mass  any chamce you can bring it down and keep factorofsafety just over  2  ? ,Providing_information
what s is your mass greater than,Asking_for_information
I was looking at what factor of safety  weight range is excellent and trying to get the lowest mass with a factor of safety around  2 ,Providing_information
for taking my part or total?,Asking_for_information
... i don t think so,Providing_information
interestingly piston-pin is the only factorofsafety under  2   but the whole factorofsafety is still quite low,Providing_information
that is what i kept uploaded to me while more well consistent my values really did not change though,Providing_information
imagine how much appreciable change is the next change possible in mass if finally you prioritize factorofsafety?,Asking_for_information
If you could reduce your  flywheelthickness  variable that would be great  :  ,Providing_information
for which are bearing bearing support offest load and crank - like pin diameter respectivly,Providing_information
is there anyway you could lower the weight and factorofsafety to just above  2 ,Asking_for_information
did you change the diameter because mine says  80   but at  105  it was excellent,Asking_for_information
You probably want to check with the piston,Providing_information
is the factorofsafety highest and mass lowest when the offset is  150  ? ,Asking_for_information
if keeping it at 40 works best for me what exactly about the three others?,Providing_information
hey i am from the conrod ltd i i was rather curious as to what you initially thought a reasonably good piston diameter would be?,Asking_for_information
r 2 equals proportional to 0 2 5 so r 3 3 equals corresponding to 0 2 and at pistonborediameter 3 equals to about 40 this gives mass equals corresponding to 0 12 and a factorofsafety equals to 3 3 44,Providing_information
it appears like our engine design currently is really excellent,Providing_information
?,Asking_for_information
That is what my document specifies  I will keep bearingoffset low unless the piston needs it to be higher,Providing_information
Wanna do me a favor and broadcast the value of  45 ,Asking_for_information
I mass currently at  40  mm diameter  which is giving me better results than the  45  mm,Providing_information
How appreciable is the change in mass if you prioritize factorofsafety ? ,Asking_for_information
generally my flywheel also partially depends on your radial crankshaft for bearing offset bearingoffset,Providing_information
do its at 2 83 to rn for me,Providing_information
conrod length to crank length ration  r   equals to   3 ,Providing_information
I now have minimum factorofsafety but i further decreased my mass,Providing_information
How appreciable is the change in mass if you prioritize factorofsafety ? ,Asking_for_information
what are your current values ? ,Asking_for_information
pistonborediameter  equals to   40  works best for me if you can make that work,Providing_information
mass 1 54 49 factorofsafety factor 2 47 47,Providing_information
my personal factorofsafety is  4   55  and my personal parameter selection minimizes mass,Providing_information
stop changing,Providing_information
can then you triple max out with the flywheeldiameter value to see what next happens?,Providing_information
also there if you click check for which broadcast at the top is it says if we re at excellent,Providing_information
then what are your current values?,Asking_for_information
I mass currentlt at factorofsafety of  2   07   so I  not the low,Providing_information
my system is also probably not the true limiting part,Providing_information
nevermind getting back at excellent now,Providing_information
Hello pistonpin  The crankshaft doesn t dep 3 end directly on your system  but please tell me if anything that I do affects you ,Providing_information
I mass leaving it as  45  at least for now,Providing_information
whilst i don doubt t really think that was my ever doing i have been broadcasting factorofsafety the values around the 8,Providing_information
1 ¶ 38,Providing_information
it doesnt affect you my mass because i got mass the pin for designer,Providing_information
since i have now i canchange it then back,Providing_information
what of all directly affects the required piston diameter? what keeping the piston diameter smaller improves both both the pin s mass and factor of safety what different factors drive up on the diameter?,Asking_for_information
the sweet just a little bit more,Providing_information
rn were only under mass so if you need to you i could still increase it a large bit,Providing_information
I chose the smallest values to give smallest weight on my end,Providing_information
Mine is at  1   59  for my most recent broadcast,Providing_information
i haven t changed anything  My factorofsafety is  3   96  and mass is  30   51   crankshaft is heavy for any situation ,Providing_information
but i have both of my values fully optimized,Providing_information
i can increase by  1  pound and factorofsafety also goes up by  1  which is a lot  can anyone lose a lot of mass with a small decrease in factorofsafety ? ,Providing_information
just not updated,Providing_information
rn I only see our global factorofsafety as  0   57  and mass as  2   16  ? ,Asking_for_information
not this much,Providing_information
I am trying my hardest  what would your factorofsafety be with that change ?  We only want it to be above  2 ,Asking_for_information
you to re already in charge of the crankshaft bearing forward offset right?,Asking_for_information
so yeah her the entire overall mass went up so i used mass about first to deliberately raise my gross mass cap and drop the factorofsafety until one of the other designers asked me to,Providing_information
they re going to leave it safe  sinc eit doesn taffect weight much,Providing_information
mass  equals to    52   factorofsafety  equals to   2   02 ,Providing_information
besides i really can probably drop some mass out of my large part now but can also take that out of other large parts,Providing_information
i have not,Providing_information
i mean i mass the low exposure factorofsafety rating of 2 000 01 now and can or t really cut any no more on mass,Providing_information
I haven t changed my broadcast,Providing_information
just reduced thread thickness to reduce of mass rate increased factorofsafety to a bit,Providing_information
what mass assembly are you at?,Asking_for_information
therefore i now have minimum gross factorofsafety but i further decrease decreased my gross mass,Providing_information
i don t exactly know the precise lowest factorofsafety on my email screen which is also 0 57,Providing_information
Not much,Providing_information
Try and minimize your mass but keep factorofsafety above  2 ,Providing_information
Range of weights was  1   49  to  4   81   My broadcast uses  1   49  with factorofsafety  equals to   4   55 ,Providing_information
So the lower pistonborediameter is the better it is for me,Asking_for_information
Just updated for pistonborediameter  equals to   40   Im getting factorofsafety of  3   44 ,Providing_information
what way was the flywheel tube thickness used?,Asking_for_information
I don t know what has changed  Ill rebroadcast what I had when we were good ,Providing_information
what is your diameter at currently ? ,Asking_for_information
who has matched the factorofsafety number of 57? do we need to work furiously on so increasing that,Asking_for_information
does changing even any other surface s parameters help not bring your mass down?,Asking_for_information
you think i optimized my part with mass relation equals to 52 and second factorofsafety ratio equals − to 2... 01,Providing_information
Hi flywheel  My crankshaft depends on your flywheel shaft diameter pistonborediameter _ s  and thickness of flywheel t _ f  I don t yet know how  but it will probably help that you know ,Providing_information
it is so 45 mm bore diameter working better then for you? i was already getting about better results at 40,Asking_for_information
What mass are you at ? ,Asking_for_information
pistonborediameter ratio equals to the 40 one works best for me if only you can only make that work,Providing_information
Is  45  mm bore diameter working better for you ?  I was getting better results at  40 ,Asking_for_information
Based on my simulations  it seems like a smaller value of  bearingoffset  will result in an overall higher factorofsafety  do you agree ? ,Asking_for_information
yeah i haven ‚ t changed anything,Providing_information
it depends heavily on maximum piston diameter,Providing_information
Right now I have a total mass of  1   49  and factorofsafety of  4   55  which appears to be good via rubric,Providing_information
what sort seems rather to me be the ideal piston for bore diameter on exiting your back end? or could possibly you explain how it affects mass and factorofsafety?,Asking_for_information
7 96 has been the previous best achieved result thus far,Providing_information
crankshaft is like  30 ,Providing_information
Not sure  But  0   03  is not a lot of mass,Providing_information
I am using the best results that I have  where bearingoffset is minimum and pistonborediameter _ bearingoffset is maximum  Inve tried other things but that is my best by far  and is the only solution I have uploaded,Providing_information
your mass is  25   98  ? ,Asking_for_information
can increase diameter is we need higher factorofsafety,Providing_information
i think you have the biggest weight contribution  so if you can optimize a bit we should be close,Providing_information
just updated my broadcast  Mass of mine is  1   49 ,Providing_information
try and totally minimize your mass intake but keep factorofsafety levels above mass 2,Providing_information
if our own current design is excellent i am quite not sure how we... did that but indeed i am happy,Providing_information
i lowered my muscle mass by about 5 ¹⁄₂ lbs,Providing_information
Ok  Do that  That s a big factorofsafety for only a gain of  0   03 ,Providing_information
I do not think it has any effect,Providing_information
how can you put yours back to life before when it never was was excellent? i suddenly think theres still some dependency that makes it go bad,Asking_for_information
... did you change the diameter because the mine says 80 but anyway at 105 metres it was excellent,Asking_for_information
Our current design is excellent  I am not sure how we did that  but I am happy ,Providing_information
we are sitting at excellent agian,Providing_information
