full_text,label
nobody touch anything haha,Providing_information
I have  3   03  with mass of  0   12  ,Providing_information
nobody touch anything haha,Providing_information
cool  not touching anything,Providing_information
nobody touch anything haha,Providing_information
No,Providing_information
oh dang,Providing_information
No we re not good,Providing_information
cool  not touching anything,Providing_information
I think  75  is the best right now,Providing_information
cool  not touching anything,Providing_information
if everone can find their lkowest mass part with an factorofsafety of over  2  that chould do it,Providing_information
I have factorofsafety  equals to   3   03  with mass  equals to   0   12  ,Providing_information
HEllo,Providing_information
nvmd,Providing_information
cool  not touching anything,Providing_information
im at  2   72 kg and  2   28  factorofsafety,Providing_information
refresh it,Providing_information
im at  2   72 kg and  2   28  factorofsafety,Providing_information
im at  2   72 kg and  2   28  factorofsafety,Providing_information
ok,Providing_information
im at  2   72 kg and  2   28  factorofsafety,Providing_information
Rod designer still here,Providing_information
i agree haha,Providing_information
Only change something if it will lower mass and keep fs greater than  2 ,Providing_information
so nevermind haha,Providing_information
as someone changes their values  all other fvalues are forced to change,Providing_information
 2   06  right,Providing_information
or maybe two or three are tied,Providing_information
Yeah that s what im trying to find out,Providing_information
my individual factorofsafety is in the range of  2000   not sure how to compare that to  2 factorofsafety on a system wide level,Providing_information
I don t think any of them will be high enough if I drop any mass,Providing_information
but we have a good design,Providing_information
sorry I was distracted by other teammates ,Providing_information
all good,Providing_information
 2   03 factorofsafety is about the factorofsafety we can do and still be very good   excellent  we need to drop the mass,Providing_information
 2   03 factorofsafety is about the factorofsafety we can do and still be very good   excellent  we need to drop the mass,Providing_information
 2   03 factorofsafety is about the factorofsafety we can do and still be very good   excellent  we need to drop the mass,Providing_information
 2   03 factorofsafety is about the factorofsafety we can do and still be very good   excellent  we need to drop the mass,Providing_information
my time is up,Providing_information
my time is up,Providing_information
End experiment  nice worK ,Providing_information
End experiment  nice worK ,Providing_information
my time is up,Providing_information
End experiment  nice worK ,Providing_information
End experiment  nice worK ,Providing_information
my time is up,Providing_information
hello,Providing_information
hello,Providing_information
hello,Providing_information
hello,Providing_information
The crankshaft bearing offset is something I need to know,Providing_information
whaddup,Providing_information
wassup,Providing_information
hi,Providing_information
yo bro,Providing_information
we gotta talk,Providing_information
piston- pin designer,Providing_information
I chose a t _ f  equals to   12   0  and pistonborediameter _ s  equals to   60   0 ,Providing_information
The piston can be any value between  3  and  15 kg,Providing_information
Im working on the connecting rod  Honestly just trying to figure out how to start,Providing_information
ive got you at  75 ,Providing_information
i mass trying to minimize the mass of crankshaft and factor of safety,Providing_information
bearingoffset equals to  150 ,Providing_information
i determine bearingoffset and dc,Providing_information
sure,Providing_information
yeah the pin is pretty light  shouldnt be an issue,Providing_information
Im working on the piston,Providing_information
trying to max factorofsafety and min weight,Providing_information
trying to max factorofsafety and min weight,Providing_information
kk ill test,Providing_information
trying to max factorofsafety and min weight of the piston,Providing_information
we are  1   94  over mass rn,Providing_information
yeah,Providing_information
we are  1   94  over mass rn,Providing_information
we are  1   94  over mass rn,Providing_information
honestly the best bet for me would be a factorofsafety of above two and make the smallest weight possible,Providing_information
my stats for flywheel are as follow,Providing_information
my graphs don t show up so i mass somewhat limited,Providing_information
we are  1   94  over mass rn,Providing_information
The highest performance is at  3   91  factorofsafety and  5   2 mass,Providing_information
t _ f  equals to   12   0  and pistonborediameter _ s  equals to   60   0 ,Providing_information
yea I can lower the mass of the piston  I have it set at  8   84 kg right now,Providing_information
its t _ h  equals to   4  and pistonborediameter  equals to   75 ,Providing_information
mass  equals to   1   27  and f _ os  equals to   15886   04 ,Providing_information
i have mass for the shaft at  18   63   fs equals to  2   06 ,Providing_information
mine also,Providing_information
pistonborediameter  equals to   75 ,Providing_information
updated my mass to  1   19 ,Providing_information
updated my mass to  1   19 ,Providing_information
we at very good rn im happy with that,Providing_information
f _ os  equals to   9193   31 ,Providing_information
yes  i design the bearingoffset and dc,Providing_information
we at very good rn im happy with that,Providing_information
f _ os  equals to   9193   31 ,Providing_information
f _ os  equals to   9193   31 ,Providing_information
we at very good rn im happy with that,Providing_information
mass  equals to   1   19 ,Providing_information
we at very good rn im happy with that,Providing_information
we can tone it down some still,Providing_information
I dont believe so,Providing_information
we can tone it down some still,Providing_information
trying to max factorofsafety and min weight,Providing_information
my goal is to minimize the crankshaft weight and maximize factorofsafety,Providing_information
we can tone it down some still,Providing_information
cool,Providing_information
yea what we have right now is perfect,Providing_information
duh,Providing_information
my current bearingoffset i  150  and dc of  30 ,Providing_information
lets try only small changes now since we are at very good  maybe make it to excellent,Providing_information
 60  ia the current value,Providing_information
can try small changes,Providing_information
I mass trying to minimize the mass of the connecting rod,Providing_information
if we could take off  2  kgs wed be golden,Providing_information
we are very good,Providing_information
helloooo,Providing_information
I mass trying to minimize the mass of the connecting rod,Providing_information
ok just making sure it updates,Providing_information
At  75  diameter for me  the best I have is  2   85 factorofsafety and  6   26 mass,Providing_information
yea my bad  I ve got  7   15 kg right now,Providing_information
we would want to reduce weight without reducing fs,Providing_information
ok somehow we now have way too much mass,Providing_information
piston diameter  pistonborediameter  is currently  105   not variable I control,Providing_information
since we are at the threshold for fs,Providing_information
ok somehow we now have way too much mass,Providing_information
minimize the mass of crankshaft and maximize factorofsafety,Providing_information
ok somehow we now have way too much mass,Providing_information
i mass determining dc and bearingoffset,Providing_information
ok somehow we now have way too much mass,Providing_information
I haven t changed anything yet,Providing_information
my bad  thanks,Providing_information
Hello I currently am discussing with a  75  diameter piston,Providing_information
 2   31 ,Providing_information
there is a default one but i mass trying to figure out how to change it,Providing_information
minimize the weight of crankshaft and increase factorofsafety,Providing_information
yea  idk who changed a value  If we cant figure it out  I can lower the piston  4  pounds,Providing_information
kg,Providing_information
i mass determining bearingoffset and dc,Providing_information
I didn t change,Providing_information
 40  inches ,Providing_information
Im not sure  the only thing that effects me is the bore diameter,Providing_information
thanks,Providing_information
ok will do,Providing_information
 18   63 ,Providing_information
ok back to very good i say leabe it,Providing_information
Crankshaft bearing offset,Providing_information
ok guys looks good,Providing_information
I have broadcasted the best value,Providing_information
ok guys looks good,Providing_information
ok back to very good i say leabe it,Providing_information
I can chang the diameter,Providing_information
ok guys looks good,Providing_information
I have broadcasted the best value,Providing_information
ok back to very good i say leabe it,Providing_information
ok guys looks good,Providing_information
ok back to very good i say leabe it,Providing_information
I have broadcasted the best value,Providing_information
I have broadcasted the best value,Providing_information
we got it,Providing_information
ok thats not me then  maybe ask around,Providing_information
Yes,Providing_information
flywheeldiameter flywheelthickness and pistonborediameter,Providing_information
and t _ h  which may be the length,Providing_information
we re at excellent,Providing_information
The piston has a diameter of  75 ,Providing_information
exellent dont touch,Providing_information
Yeah I mass talking to the crankshaft,Providing_information
exellent dont toucu,Providing_information
awesome,Providing_information
yuppppp,Providing_information
or we were for a second,Providing_information
the current optimal bearingoffset and dc i got that yields best results is bearingoffset  equals to   150  and dc  equals to   50 ,Providing_information
ok I change pistonborediameter right now its still  75 ,Providing_information
the current optimal bearingoffset and dc i got that yields best results is bearingoffset  equals to   150  and dc  equals to   50 ,Providing_information
and a tH of  10   5 ,Providing_information
I have not selected anything yet  Still looking through my options,Providing_information
bearingoffset is bearing support offset,Providing_information
agreed,Providing_information
dc is crank-pin diameter,Providing_information
 40  inches currently,Providing_information
the current optimal bearingoffset and dc i got that yields best results is bearingoffset  equals to   150  and dc  equals to   50 ,Providing_information
i mass having the best value now,Providing_information
alright we re at very good  I say lets leave it at this,Providing_information
and flywheel thickness,Providing_information
ayyy the status is good somehow,Providing_information
we just had excellent but someone touched it,Providing_information
we need to decrease the mass,Providing_information
we need to decrease the mass,Providing_information
we need to decrease the mass,Providing_information
we need to decrease the mass,Providing_information
We re at very good  I say we leave it at this,Providing_information
agreed,Providing_information
we got excellent,Providing_information
Actually its better now,Providing_information
Its excellent rn so dont change it without writing down what you have now,Providing_information
we got excellent,Providing_information
Yeah  Im on the second lightest option,Providing_information
Its excellent rn so dont change it without writing down what you have now,Providing_information
Its excellent rn so dont change it without writing down what you have now,Providing_information
we got excellent,Providing_information
the mass of the piston is currently  2   23 ,Providing_information
Its excellent rn so dont change it without writing down what you have now,Providing_information
we got excellent,Providing_information
For the flywheel shaft diameter i have  10 ,Providing_information
Yeah,Providing_information
I can change diameter if needed,Providing_information
sweet we re at excellent,Providing_information
Its excellent now,Providing_information
Yeah,Providing_information
ranges from 0   45  to  4   43 ,Providing_information
For the diameter it is  25  right now,Providing_information
yea we re at excellent,Providing_information
cool we should be good then,Providing_information
Sweet we re at excellent quality rn,Providing_information
cool,Providing_information
I mass on the lightest option  but if I go up at all we ll go over  3 ,Providing_information
Ok  mine is only   5   Idk how factorofsafety works but mine goes above  5 k,Providing_information
perfect  thank you,Providing_information
nice,Providing_information
I can try lower mass  however pistonborediameter will need to increase to compensate for the reduced factorofsafety,Providing_information
lmk what you think,Providing_information
lmk what you think,Providing_information
lmk what you think,Providing_information
great  done then,Providing_information
great  done then,Providing_information
great  done then,Providing_information
no problem,Providing_information
We can make that happen,Providing_information
factorofsafety should be around  5  for everyone  Making it larger doesn t seem to help the sub-system factorofsafety,Providing_information
I think were good  We are at the highest point we can be  Good job ,Providing_information
haha good can t wait to go work on this lab,Providing_information
awesome  go team,Providing_information
pistom-pin designer says increase the diameter,Providing_information
gotta love it,Providing_information
 however pistonborediameter will need to increase to compensate for the reduced factorofsafety ,Providing_information
cool,Providing_information
i havent really started yet,Providing_information
the bearingoffset and dc i currently have yields best factorofsafety which is  2   283  but it s not the lightest,Providing_information
mine only goes up to  30  max,Providing_information
I dont think those effect my design  Also I think we are already at an excellent rating so we shouldnt need to change anything else,Providing_information
thats fine we already have the highest rating with an acceptable factorofsafety,Providing_information
I spent a lot of time staring at it questioning my basic knowledge of engineering so I pistonborediameter recommend starting haha,Providing_information
i could change so that it have factorofsafety of  2  but weights  2  kg lighter,Providing_information
I have mass at  0   14  and factorofsafety at  2   6  currently,Providing_information
sounds good,Providing_information
ive got a factorofsafety of  3   91   lets see if we can get it further above  2 ,Providing_information
check with the others,Providing_information
for my component,Providing_information
The weight will go over if I increase diameter,Providing_information
Higher offset lowers my factorofsafety a lot just fyi,Providing_information
weight let me update my design,Providing_information
i haven t updated,Providing_information
pretty good  how about yourself,Providing_information
wait ,Providing_information
Not too bad  not excited for the lab,Providing_information
i updated,Providing_information
Don t worry  you re a pistonpin you can do anything,Providing_information
i updated my design,Providing_information
If i increase diameter we go over weight  Still on lowest setting,Providing_information
ok so your mass should be fine  not a big contributing factor,Providing_information
it got worse so i would change it back,Providing_information
i think we should just leave it,Providing_information
I have mass at  0   14  and factorofsafety at  2   6  currently for my component  if you are in charge of the piston bore diameter  I got these values by setting pistonborediameter  equals to   45 ,Providing_information
ok so it probably changes mass a lot and we can try improve factorofsafety some with other parts,Providing_information
Someone just changed something,Providing_information
i didnt change anything,Providing_information
If we increase the diameter we go over the weight limit,Providing_information
dont change it theyre changing it back,Providing_information
Ok  60  is my lowest possible so I ll leave it at that,Providing_information
  45 - 5 ,Providing_information
I haven t touched any,Providing_information
me neither  poor now,Providing_information
woah were at poor now,Providing_information
Wait we ve gone down to poor quality now,Providing_information
I mass on  0   69  now with a factorofsafety of  3   84 ,Providing_information
yeah  I worked on lowering the mass as low as I can,Providing_information
now poor,Providing_information
well if it lowers the mass you could raise it because it looks like we need to work on mass more,Providing_information
the one we currently have is the default,Providing_information
keep your values from the max score we got the other guy will fix it,Providing_information
the factorofsafety is quit low,Providing_information
I have not,Providing_information
Yeah I won t,Providing_information
I didnt,Providing_information
Crankshaft asked for bore diameter  Thats all,Providing_information
I have piston diameter,Providing_information
i didnt change,Providing_information
pistonborediameter equals to   47   4  or  40  for me,Providing_information
ok good  I would just assume your part has the most mass,Providing_information
it s poor again lol,Providing_information
I mass using  47   5 ,Providing_information
rn is very,Providing_information
very good,Providing_information
right now,Providing_information
Yeah we were at excellent but we ve gone back down to poor now somehow,Providing_information
We need to save weight ,Providing_information
I had it at mass  equals to   0   04  and f  equals to   0   74  when the status of the engine was good,Providing_information
we had excelent at one point,Providing_information
i updated another design,Providing_information
No  I only have one good value  No experimentation required,Providing_information
My mass range is around  0   02  to   12 ,Providing_information
I got good results with  55   but trying to bring down the mass,Providing_information
Will do I wrote them down,Providing_information
I have not chnaged anything,Providing_information
I mass looking for the lowest mass with highest factorofsafety right now,Providing_information
 47   5 ,Providing_information
great,Providing_information
then it was not me,Providing_information
I agree,Providing_information
It wasn t me or the piston  Ive recorded my values in case something happens,Providing_information
ok i ll ask around,Providing_information
I havn t changed it since the beginning,Providing_information
 40   70 ,Providing_information
Yeah same here,Providing_information
I have lowest mass currently without making factorofsafety poor,Providing_information
yes,Providing_information
The crankshaft changed something,Providing_information
nah i dont think that would change the varialbes for me,Providing_information
I dont believe so,Providing_information
ok mine is like   5 - 1  so im trying to change factorofsafety more,Providing_information
Nope must be the other two that need that,Providing_information
at some point  need to get mass down,Providing_information
my bad lol the range of mass is like  0     0   1  ish,Providing_information
He changed it and it went to very good,Providing_information
But it s back to poor now again,Providing_information
i did,Providing_information
I am not sure  haven t heard from fly wheel or crankshaft,Providing_information
 your,Providing_information
I imagine these would contribute to more mass,Providing_information
 your,Providing_information
we are at very good again as of  12  ;  53 ,Providing_information
someone is changing stuff,Providing_information
I may change it back to  55  though if that works with yours ,Providing_information
not me,Providing_information
my mass is  5   2  and factorofsafety is  3   91 ,Providing_information
yes,Providing_information
my mass is  5   2  and factorofsafety is  3   91 ,Providing_information
hmm ok I ll check around,Providing_information
my mass is  5   2  and factorofsafety is  3   91 ,Providing_information
we are at very good again as of  12  ;  53 ,Providing_information
I didnt change anything,Providing_information
we are at very good again as of  12  ;  53 ,Providing_information
at that  I can get mass  equals to   0   12  and factorofsafety  equals to   3   03  which are good values,Providing_information
no I am just refreshing,Providing_information
we are at very good again as of  12  ;  53 ,Providing_information
just changed it to  25  pistonborediameter and t is  10 ,Providing_information
That s where it was when we got the result as good,Providing_information
Ok,Providing_information
ok,Providing_information
Okay we are good now,Providing_information
sweet,Providing_information
nah,Providing_information
The conrod hasn t changed anything,Providing_information
bearingoffset  equals to   150  and dc  equals to   45 ,Providing_information
no I got my best value,Providing_information
 0   45  kg to  4   43 ,Providing_information
got em,Providing_information
The crankshaft designed is changing values,Providing_information
this is as good as i can get i think,Providing_information
 Good ,Providing_information
ok neither have i,Providing_information
i see that,Providing_information
ok yeah so really small  I was just wondering why mass was so high,Providing_information
this is as good as i can get,Providing_information
based on the current values  it should say excellent,Providing_information
yep ,Providing_information
oh damn mine is  0   0   06  when i put diameter as  50 ,Providing_information
based on the current values  it should say excellent,Providing_information
i mass trying to minimize weight while keeping factorofsafety around  2 ,Providing_information
based on the current values  it should say excellent,Providing_information
Okay let s keep it at that then,Providing_information
not me,Providing_information
based on the current values  it should say excellent,Providing_information
piston range is pretty high,Providing_information
bore diameter flywheel shaft diameter and flywheel thickness,Providing_information
 47   5 ,Providing_information
no we need mass below  35 ,Providing_information
ok im gonna try to get us to exellent dont change,Providing_information
i was at t equals to  10  and pistonborediameter equals to  15  or  20 ,Providing_information
ok thx,Providing_information
ok,Providing_information
my current value is bearingoffset  equals to   150  and dc  equals to   45 ,Providing_information
ok im gonna try to get us to exellent dont change,Providing_information
only one i use is bearingoffset,Providing_information
ok,Providing_information
we are at  Good  now,Providing_information
Yeah they said they re not going to change it now,Providing_information
No I have not,Providing_information
nah its above  35 ,Providing_information
 18   63  and factorofsafety  equals to   2   06 ,Providing_information
ok im gonna try to get us to exellent dont change,Providing_information
I am simply sitting here,Providing_information
I do the control flywheeldiameter but its the same,Providing_information
ok still at  60 ,Providing_information
ok im gonna try to get us to exellent dont change,Providing_information
flywheeldiameter  equals to   50 ,Providing_information
crankshaft is talking  but he she depends on flywheel,Providing_information
me too,Providing_information
the highest factorofsafety rn for me is  0   89 ,Providing_information
that wasnt me,Providing_information
that wasnt me,Providing_information
no they remain the same,Providing_information
 37   46  and  2   06 ,Providing_information
that wasnt me,Providing_information
I think the flywheel is changing,Providing_information
that wasnt me,Providing_information
ok i have the factorofsafety at  2   85  and mass as  6   26 ,Providing_information
looks like mass dropped a lot,Providing_information
I have not touched mine,Providing_information
my second option is mass  equals to   20   55  and factorofsafety  equals to   2   83 ,Providing_information
I cant get a response tho,Providing_information
is flywheel talking greater than ,Providing_information
It just changed back to good,Providing_information
Talking with crankshaft since we need to coordinate on mass,Providing_information
I did and piston should be low now  rod is only a mass of   14 ,Providing_information
 37   49  kg and  2   06 ,Providing_information
damn,Providing_information
mass  1   83  and factorofsafety  1   92 ,Providing_information
i have the factorofsafety at  2   85  and mass as  6   26 ,Providing_information
i have the factorofsafety at  2   85  and mass as  6   26 ,Providing_information
Our mass keeps going up,Providing_information
i have the factorofsafety at  2   85  and mass as  6   26 ,Providing_information
I have not changed mine,Providing_information
the plot on the white board,Providing_information
 4   42  and  10   19 ,Providing_information
probably,Providing_information
i meant for your part,Providing_information
factorofsafety greater than  2  and mass lesser than  35 ,Providing_information
ill try,Providing_information
gives excellent,Providing_information
I think the flywheel keeps changing values  I cant get a response tho,Providing_information
i wouldnt up your weight,Providing_information
the mass from my part is pretty small but i can get factorofsafety to like  0   89 ,Providing_information
 0   1 ,Providing_information
smallest,Providing_information
oh I see,Providing_information
i know  my design is basically fixed,Providing_information
